"DESCRIPTION","DURATION IN MS","NAME","PARENT SUITE","START TIME","STATUS","STOP TIME","SUB SUITE","SUITE","TEST CLASS","TEST METHOD"
"","5818","checkout with","","2026-06-22","passed","2026-06-22","","checkout","checkout with",""
"","7968","Add products to cart","","2026-06-22","passed","2026-06-22","","Add to cart","Add products to cart",""
"","5618","checkout with 1 product","","2026-06-22","passed","2026-06-22","","checkout","checkout with 1 product",""
"","2898","Login with valid credentials","","2026-06-21","passed","2026-06-21","","login","Login with valid credentials",""
"","1335","Login with valid credentials","","2026-06-22","passed","2026-06-22","","login","Login with valid credentials",""
"","5778","Login with invalid credentials","","2026-06-22","passed","2026-06-22","","negative login","Login with invalid credentials",""
"","129303","checkout with 1 product","","2026-06-22","passed","2026-06-22","","checkout","checkout with 1 product",""
"","2893","Login with valid credentials","","2026-06-21","passed","2026-06-21","","login","Login with valid credentials",""
